{
  "schema_version": "1.0.0",
  "manifest_type": "EXPECTED_DEPLOYMENT",
  "platform": "COPILOT_STUDIO",
  "configuration": {
    "environment": {
      "scope": "ANY_MICROSOFT_365_WORK_OR_EDUCATION_TENANT",
      "display_name": "TARGET_TENANT_SELECTED_AT_INSTALL",
      "immutable": false,
      "identifier_storage": "LOCAL_RECEIPT_FINGERPRINT_ONLY"
    },
    "instructions": {
      "source_path": "copilot/studio/STUDIO_INSTRUCTIONS.md",
      "source_sha256": "3a27f02741e8b7972240ee76c937f45bd2e957bd38258ffb83d1f759a9471fa7",
      "canonical_text_sha256": "3c6d7795ab9e22e38826dbfc294621cb8e53853331a58d0d972876a0802b4043",
      "source_bytes": 17880,
      "utf8_sig": true
    },
    "model": {
      "display_name": "GPT-5.6 Reasoning",
      "selection": "PLATFORM_OBSERVED",
      "identity_or_capability_proof": false
    },
    "skill_zip": {
      "archive_name": "teach-grounded-scenarios-student.zip",
      "sha256": "e3d285b2d5922bac62d493059c9b55ab48f605a364f94f1899f3df4083f62a91",
      "file_count": 25
    },
    "resources": {
      "tools": {
        "mode": "NONE"
      },
      "knowledge": {
        "mode": "SEARCH_ALL_WEBSITES_PLUS_CURRICULUM_FILES",
        "web_search": {
          "enabled": true,
          "scope": "ALL_WEBSITES"
        },
        "max_live_file_bytes": 16777216,
        "original_source_count": 3,
        "live_file_count": 4,
        "curriculum_sources": [
          {
            "school_level": "ELEMENTARY",
            "original_filename": "[별책2] 초등학교 교육과정.pdf",
            "original_bytes": 6652397,
            "original_sha256": "fe053096df68d788d3e81b1098a526d21ad9d2825a0d715d448ba12f5b32ebcd",
            "original_page_count": 521,
            "authority_role": "CURRICULUM_AUTHORITY",
            "non_academic_fact_authority": false,
            "authority_limit_ko": "교육과정의 범위·성취기준·용어를 정하는 자료이며 역사·과학·통계·법령의 개별 사실을 자동으로 확정하지 않는다.",
            "source_locator": "LOCAL_RECEIPT_ONLY",
            "repository_copy": false,
            "live_fragments": [
              {
                "live_filename": "[별책2] 초등학교 교육과정.pdf",
                "bytes": 6652397,
                "sha256": "fe053096df68d788d3e81b1098a526d21ad9d2825a0d715d448ba12f5b32ebcd",
                "page_count": 521,
                "page_range": {
                  "start": 1,
                  "end": 521
                },
                "mapped_original_sha256": "fe053096df68d788d3e81b1098a526d21ad9d2825a0d715d448ba12f5b32ebcd",
                "content_preservation": "ORIGINAL_FILE"
              }
            ]
          },
          {
            "school_level": "MIDDLE",
            "original_filename": "[별책3] 중학교 교육과정.pdf",
            "original_bytes": 8945675,
            "original_sha256": "03c6e28b18ee526b00a95a642fc24f3f80f23d268685ff2795572ac3420d5c3a",
            "original_page_count": 677,
            "authority_role": "CURRICULUM_AUTHORITY",
            "non_academic_fact_authority": false,
            "authority_limit_ko": "교육과정의 범위·성취기준·용어를 정하는 자료이며 역사·과학·통계·법령의 개별 사실을 자동으로 확정하지 않는다.",
            "source_locator": "LOCAL_RECEIPT_ONLY",
            "repository_copy": false,
            "live_fragments": [
              {
                "live_filename": "[별책3] 중학교 교육과정.pdf",
                "bytes": 8945675,
                "sha256": "03c6e28b18ee526b00a95a642fc24f3f80f23d268685ff2795572ac3420d5c3a",
                "page_count": 677,
                "page_range": {
                  "start": 1,
                  "end": 677
                },
                "mapped_original_sha256": "03c6e28b18ee526b00a95a642fc24f3f80f23d268685ff2795572ac3420d5c3a",
                "content_preservation": "ORIGINAL_FILE"
              }
            ]
          },
          {
            "school_level": "HIGH",
            "original_filename": "[별책4] 고등학교 교육과정_국가교육위원회고시제2024-3호(2024.08.16.)_수정.pdf",
            "original_bytes": 22424153,
            "original_sha256": "456f3181d45a92b33d83b86f144f41ce1c832918671162ec4e82b4d91ddcd6d0",
            "original_page_count": 2215,
            "authority_role": "CURRICULUM_AUTHORITY",
            "non_academic_fact_authority": false,
            "authority_limit_ko": "교육과정의 범위·성취기준·용어를 정하는 자료이며 역사·과학·통계·법령의 개별 사실을 자동으로 확정하지 않는다.",
            "source_locator": "LOCAL_RECEIPT_ONLY",
            "repository_copy": false,
            "live_fragments": [
              {
                "live_filename": "[별책4] 고등학교 교육과정_1-1108쪽.pdf",
                "bytes": 11313085,
                "sha256": "3e4def0e7c528685cf9f4d5214177559bf934175b53a7dc89625cb320607367f",
                "page_count": 1108,
                "page_range": {
                  "start": 1,
                  "end": 1108
                },
                "mapped_original_sha256": "456f3181d45a92b33d83b86f144f41ce1c832918671162ec4e82b4d91ddcd6d0",
                "content_preservation": "PAGE_RANGE_SPLIT_FROM_ORIGINAL"
              },
              {
                "live_filename": "[별책4] 고등학교 교육과정_1109-2215쪽.pdf",
                "bytes": 12415445,
                "sha256": "534205af5091e144b4d8e5475b72f9ddbbf1b2f6d320370b3b016218e715e7be",
                "page_count": 1107,
                "page_range": {
                  "start": 1109,
                  "end": 2215
                },
                "mapped_original_sha256": "456f3181d45a92b33d83b86f144f41ce1c832918671162ec4e82b4d91ddcd6d0",
                "content_preservation": "PAGE_RANGE_SPLIT_FROM_ORIGINAL"
              }
            ]
          }
        ]
      },
      "connected_agents": {
        "mode": "NONE"
      },
      "memory": {
        "enabled": false
      }
    }
  },
  "live_contract": {
    "receipt_location": ".reverse-local/deployment-receipts/copilot-studio.json",
    "identifier_policy": "LOCAL_FINGERPRINT_ONLY",
    "required_checks": [
      "skill_processing",
      "knowledge_processing",
      "configuration_saved",
      "publication",
      "environment_name",
      "model_selection",
      "resource_state",
      "live_canary"
    ],
    "completion_policy": "ALL_REQUIRED_CHECKS_PASS_WITH_BROWSER_EVIDENCE"
  },
  "public_repository": {
    "contains_live_identifiers": false,
    "contains_live_urls": false,
    "contains_tokens_or_credentials": false
  },
  "seal_sha256": "5015214bf2f7f1bba4c14e320c290541705a4df7008b7aeaaca33f0f61fda3f4"
}
